{
  "type": "object",
  "additionalProperties": false,
  "properties": {
    "schema_version": {
      "const": "1.1.0"
    },
    "scene_id": {
      "type": "string",
      "pattern": "^[a-z][a-z0-9_]*$"
    },
    "title": {
      "type": "string",
      "minLength": 1
    },
    "time_alignment": {
      "enum": ["relative", "absolute"]
    },
    "runs": {
      "type": "array",
      "minItems": 1,
      "uniqueItems": true,
      "items": {
        "type": "string",
        "pattern": "^[A-Za-z0-9][A-Za-z0-9_-]*$"
      }
    },
    "layers": {
      "type": "array",
      "minItems": 1,
      "items": {
        "type": "object",
        "additionalProperties": false,
        "properties": {
          "run_id": {
            "type": "string",
            "pattern": "^[A-Za-z0-9][A-Za-z0-9_-]*$"
          },
          "layer_id": {
            "type": "string",
            "pattern": "^[a-z][a-z0-9_]*$"
          },
          "visible": {
            "type": "boolean"
          }
        },
        "required": ["run_id", "layer_id", "visible"]
      }
    },
    "camera": {
      "type": "object",
      "additionalProperties": false,
      "properties": {
        "position": {
          "type": "array",
          "items": {
            "type": "number"
          },
          "minItems": 3,
          "maxItems": 3
        },
        "target": {
          "type": "array",
          "items": {
            "type": "number"
          },
          "minItems": 3,
          "maxItems": 3
        }
      },
      "required": ["position", "target"]
    }
  },
  "required": ["schema_version", "scene_id", "title", "time_alignment", "runs", "layers"],
  "$schema": "https://json-schema.org/draft/2020-12/schema"
}
