{
  "schema_version": "1.1.0",
  "scene_id": "tower_hamlets",
  "title": "Canary Wharf \u00b7 estimated One Canada Square steel facade study",
  "time_alignment": "relative",
  "runs": [
    "canary_wharf_appearance_one_canada_001"
  ],
  "layers": [
    {
      "run_id": "canary_wharf_appearance_one_canada_001",
      "layer_id": "geometry",
      "visible": true
    }
  ]
}
