{
  "schema_version": "1.1.0",
  "scene_id": "white_city",
  "title": "Daylight thermal diagnostic \u00b7 controlled forcing",
  "time_alignment": "relative",
  "runs": [
    "legacy_web",
    "diurnal_20260930T095929Z_59deae"
  ],
  "layers": [
    {
      "run_id": "legacy_web",
      "layer_id": "geometry",
      "visible": true
    },
    {
      "run_id": "diurnal_20260930T095929Z_59deae",
      "layer_id": "air",
      "visible": true
    },
    {
      "run_id": "diurnal_20260930T095929Z_59deae",
      "layer_id": "surface",
      "visible": false
    }
  ]
}