{
  "schema_version": "1.1.0",
  "scene_id": "white_city",
  "title": "solar \u00b7 20261221",
  "time_alignment": "relative",
  "runs": [
    "legacy_web",
    "city_solar_20261221_20260930T095257Z_f293ce"
  ],
  "layers": [
    {
      "run_id": "legacy_web",
      "layer_id": "geometry",
      "visible": true
    },
    {
      "run_id": "city_solar_20261221_20260930T095257Z_f293ce",
      "layer_id": "solar",
      "visible": true
    }
  ]
}