{
  "schema_version": "1.1.0",
  "scene_id": "tower_hamlets",
  "title": "Canary Wharf · roof refinement 002",
  "time_alignment": "relative",
  "runs": [
    "canary_wharf_refinement_002"
  ],
  "layers": [
    {
      "run_id": "canary_wharf_refinement_002",
      "layer_id": "geometry",
      "visible": true
    }
  ]
}
