{
  "schema_version": "1.1.0",
  "scene_id": "tower_hamlets",
  "title": "Canary Wharf \u00b7 20 Water Street, 15 Water Street and YY London estimated exterior details",
  "time_alignment": "relative",
  "runs": [
    "canary_wharf_appearance_exterior_completion_009"
  ],
  "layers": [
    {
      "run_id": "canary_wharf_appearance_exterior_completion_009",
      "layer_id": "geometry",
      "visible": true
    }
  ],
  "camera": {
    "position": [
      -170,
      360,
      205
    ],
    "target": [
      0,
      65,
      40
    ]
  }
}
