{
  "schema_version": "1.1.0",
  "scene_id": "thapar_university",
  "title": "winter \u00b7 exploratory wind and temperature",
  "time_alignment": "relative",
  "runs": [
    "osm_geometry_20261005T110125Z_1bf7f0",
    "climate_winter_20261005T110910Z_338727"
  ],
  "layers": [
    {
      "run_id": "osm_geometry_20261005T110125Z_1bf7f0",
      "layer_id": "geometry",
      "visible": true
    },
    {
      "run_id": "climate_winter_20261005T110910Z_338727",
      "layer_id": "wind",
      "visible": true
    },
    {
      "run_id": "climate_winter_20261005T110910Z_338727",
      "layer_id": "temperature",
      "visible": true
    },
    {
      "run_id": "climate_winter_20261005T110910Z_338727",
      "layer_id": "surface",
      "visible": false
    }
  ],
  "camera": {
    "position": [
      1800,
      -2200,
      1800
    ],
    "target": [
      0,
      0,
      0
    ]
  }
}
