{
  "schema_version": "1.1.0",
  "scene_id": "thapar_university",
  "title": "Refined geometry only \u00b7 visual_study_directorate",
  "time_alignment": "relative",
  "runs": [
    "visual_study_roofs_20261008_geometry"
  ],
  "layers": [
    {
      "run_id": "visual_study_roofs_20261008_geometry",
      "layer_id": "refined_geometry",
      "visible": true
    },
    {
      "run_id": "visual_study_roofs_20261008_geometry",
      "layer_id": "roof_detail",
      "visible": true
    }
  ],
  "camera": {
    "position": [
      550,
      -285,
      48
    ],
    "target": [
      525,
      -215,
      3
    ]
  }
}